Title,Country,City,Job_type,Job_level,Mode,Area,Salary,Date,Applicants,Company,Skills,Functions,Requirements,URL
Ingeniero Monitoreo Apm Dynatrace,Colombia,,Remoto,Semi Senior,FULL_TIME,SysAdmin / DevOps / QA,1950.0,2023-07-24,20.0,Sophos Solutions,"['Cloud Computing', 'Cloud', 'Linux', 'UNIX', 'Cisco']","Análisis y monitoreo de la disponibilidad y rendimiento de las aplicaciones en dynatrace
Creación de tableros de monitoreo en dynatrace (infraestructura y desempeño)
Análisis e interpretación de métricas de monitoreo, incidentes y mejora en integraciones
Colaborar con equipos multiculturales, crear nuevas conexiones y aprendizajes
Crecer personal y profesionalmente, aprovechando todos los programas de formación, integración, movilidad y en especial balance de vida","2 a 3 años de experiencia mínima como: ingeniero de redes, analista de monitoreo, especialista de monitoreo de redes, ingeniero de monitoreo, consultor de monitoreo, administración Dynatrace, Solution Engineer APM, Especialista Splunk, ingeniero monitoreo,
Si eres técnico, tecnólogo y/o profesional en áreas como: ingeniería de sistemas o carreras afines cuentas con 3 años de experiencia en monitoreo de infraestructura servidores Windows y/o Linux, bases de datos, elementos de red (CISCO), monitoreo de enlaces de red, aplicaciones, correlación de eventos, registro de incidentes o requerimientos, en especial con algún tipo de herramienta de monitoreo de desempeño de aplicaciones (APM) como: Dynatrace, Solarwinds, grafana, kibana, datadog o Splunk.
Experiencia mínima comprobable en administración de herramientas de monitoreo/Dynatrace como APM, DPM, AppEngine, AppAgent, etc.
Conocimientos básicos de programación en cualquier lenguaje (jerarquía de operadores, tipos de datos, condicionales, archivos, bucles, arreglos y estructuras)
Experiencia en sistemas operativos Linux, Unix, Windows, (sistema de archivos, jerarquía de sistemas, comandos de gestión de archivos, expresiones regulares, grep)
Conocimiento Dynatrace (APMs y DPM) Creación de tableros operativos a nivel de infraestructura, aplicación y experiencia de usuario, administración e interpretación de indicadores.
Creación de paneles (dashboards) y gráficos dentro de la plataforma Dynatrace.
Administración en Dynatrace para configuración de requests attributes, calculated metrics, SLOs, Synthetics, user experience, custom devices, alertamientos.",https://www.getonbrd.com/empleos/sysadmin-devops-qa/ingeniero-monitoreo-apm-dynatrace-remoto-sophos-solutions-remote
Front-end Engineer,,,Remoto,Semi Senior,CONTRACTOR,Programación,No hay información,2023-06-05,259.0,Precision Music,"['HTML5', 'Python', 'CSS', 'Bootstrap', 'UI Design', 'Back-end', 'JavaScript', 'Front-end']","You will work with our front-end stack in HTML, Bootstrap, Javascript and Ajax. You will be at least somewhat familiar with linking front-end to back-end. You will build components, such as live search, multi-step forms, etc. You will be a decision maker in how the user interacts with the product.","You should have experience developing a user interface that enables the user to get the job done
You should have an eye for good design and to be able to make and recognize something beautiful
You will need to work with HTML, Bootstrap, Javascript, and Ajax
You may need to link your code with Python back-end",https://www.getonbrd.com/empleos/programacion/front-end-engineer-precision-music-remote
Administrador de Servicios TI,Chile,Santiago,Presencial,Semi Senior,FULL_TIME,Operaciones / Admin,1750.0,2023-06-06,20.0,CMPC,['SAP'],"Misión del cargo:
Responsable por la atención de los requerimientos de soporte tanto en tiempo y forma que presenten los usuarios de la compañía. Responsable, además, del cumplimiento de las políticas de TI en su área de responsabilidad, velando por las mejora continuas, y las acciones necesarias para asegurar un servicio de calidad, junto con participar y apoyar de los proyectos del área TI que se requieran.
Funciones específicas:
Asegurar la oportuna atención de los incidentes de acuerdo a su nivel de urgencia, coordinando los procesos de atención de los clientes y usuarios.
Detectar necesidades especiales de cada cliente, generando órdenes de atención.
Velar por el cumplimiento de la política de TI.
Preparar informes de análisis de fallas relevantes y coordinación de acciones de mejora.
Coordinar todos los cambios que se producen sobre las infraestructuras locales, desde que se solicitan, hasta que se implementan.
Responsable de los servicios tecnológicos.","Requisitos:
Ingeniería Informática o carrera afín. Titulado.
Manejo avanzado en operaciones, configuraciones y sistemas operativos.
Experiencia en Soporte de Redes.
Manejo Sistema SAP.
Al menos 3 años de experiencia en cargos similares (de preferencia en rubro industrial).",https://www.getonbrd.com/empleos/operaciones-management/administrador-servicios-ti-cmpc-santiago
Programador Full-Stack,Chile,Santiago,Híbrido,Junior,FULL_TIME,Programación,1650.0,2023-08-02,5,ANDAIN,"['MySQL', 'Node.js', 'AngularJS', 'HTML5', 'Ionic', 'Data Architecture', 'Express', 'Full-stack', 'Back-end', 'TypeScript', 'JavaScript', 'Angular', 'Front-end']","Dentro de tus responsabilidades en el cargo, se comprenden el desarrollar para nuestra solución de gestión, así como también el desarrollar soluciones técnicas para los desafíos implícitos en las mejoras continuas, incluyendo soluciones exclusivas para algunos clientes.","Buscamos sólidos conocimientos de programación de aplicaciones en NodeJS, Typescript y MySQL.
Imprescindible sólidos conocimientos y experiencia con framework Express e Ionic y haber trabajado con proyectos utilizando MySQL.
Será considerado un plus si cuentas con experiencia en Funciones Lambda, Angular, TypeScript, HTML.
Buscamos team players, personas con habilidades de comunicación interpersonal, creatividad, sentido del humor y que no posean reparos al compartir sus conocimientos con el resto del equipo",https://www.getonbrd.com/empleos/programacion/programador-fullstack-andain-santiago
Full-Stack Developer: Node + React,5 ubicaciones,,Remoto,Senior,FULL_TIME,Programación,3600.0,2023-07-06,98,Leniolabs_,"['Node.js', 'Virtualization', 'Git', 'React', 'Data Architecture', 'Amazon Web Services', 'API', 'Full-stack', 'Back-end', 'Agile', 'Cloud Computing', 'TypeScript', 'English', 'JavaScript', 'Cloud']","Actualmente, estamos en la búsqueda de un Full-Stack Developer, que se quieran unir a Leniolabs, la persona que se sume trabajará directamente en del desarrollo de un producto externo de la empresa, relacionada con un software as service, manteniendo relación directa con el cliente.
Se trabajará en el departamento de desarrollo de tecnología de la empresa
Trabajo en equipo - liderazgo
Será responsable de avanzar en los diferentes requerimientos del cliente, junto con el equipo.
Su trabajo consiste en hacer que las tareas se realicen utilizando todos los recursos disponibles (tangibles e intangibles) - específicamente del producto de gestión financiera.
Contamos internamente con personas capacitadas para realizar QA, Líder de proyecto, etc, por lo cual tendrá la responsabilidad de adaptarse a cada equipo","Estamos buscando desarrolladores con el siguiente Skill:
· Conocimientos y experiencia en React y typeScript (indispensable) 
· Sólidos conocimientos y experiencia + 5 años de experiencia en desarrollo de software con NodeJs(indispensable)
. Experiencia con AWS: CDK, servicios API Gateway, SQS, SNS, así como Lambda, y EventBridge (Deseable) 
· Pensamiento crítico y capacidad de resolver problemas
· Buen nivel de Inglés oral y escrito (B2/C1) (indispensable)
· Manejo de metodologías ágiles.
· Uso avanzado de Git
· Buen trabajo en equipo",https://www.getonbrd.com/empleos/programacion/full-stack-developer-node-react-leniolabs_-remote-ea55
Software Engineer,,,Remoto,Semi Senior,CONTRACTOR,Programación,No hay información,2023-07-24,145,Passport Shipping,"['MySQL', 'Redis', 'Node.js', 'Git', 'Express', 'Elasticsearch', 'REST API', 'Back-end', 'TypeScript', 'English', 'JavaScript', 'Cloud', 'Web Service']","Solve synchronization and load issues of our distributed API
Create and optimize relational data queries collaborating with our data specialists
Implement effective scheduled data processing tasks with our internal Routines framework
Generate properly tagged log data and analyze it with Elasticsearch
Use the power of cloud-based AWS tools and Prometheus/Grafana monitoring
Enrich our fancy knowledge base in Notion with new details and articles
Learn about the world of international shipping
Deal with popular e-commerce platforms as Shopify, Bigcommerce, Magento
Understand our clients’ pain points and needs, collaborate with some of them directly to ensure the success
Be a part of a supporting team that will help you to adapt, improve and cope with failures","3+ years software development experience
A college graduate with a technical degree
Proficient in English reading and writing
Expertise with TypeScript, NodeJS, Express framework, MySQL, Redis, Git, Elasticsearch
Experience in building distributed cloud-based REST API web services
Ability to communicate effectively and clearly and collaborate with other teams
Transparency and accuracy in task management
Fast adaptation to existing code styles, practices and conventions combined with the ability to take an active role in their continuous review and improvement
Work autonomy: skill of improving things with little guidance, but without any hesitation about clarifying questionable points
Accountability: You take ownership of your work, the answers you provide to others, and learn from your mistakes",https://www.getonbrd.com/empleos/programacion/software-engineer-passport-shipping-remote-ebcd
React Front-end Developer,,,Remoto,Semi Senior,FULL_TIME,Programación,5000.0,2023-07-21,284,Amuntalent,"['HTML5', 'CSS', 'React', 'SaaS', 'API', 'Functional Programming', 'TDD', 'Jest', 'User Testing', 'TypeScript', 'JavaScript', 'Front-end', 'Collection manager']","Tu rol consistirá en optimizar las herramientas de tecnologías de la información para la gestión de talento, procesos automatizados, ATS, procesos de contratación, experiencia de usuario.
Participarás en la elaboración de plataformas en internet para optimizar los servicios de reclutamiento de la compañía, ampliar la red de talento, crear nuevas plataformas para publicación de vacantes, gestión de talento, enviar alertas para nuevas oportunidades laborales.
Develop user facing features for web applications
Build user interface functionality across browsers and devices
Building reusable code and libraries for future use.
Develop a scalable and maintainable Web component architecture
Ensure the optimized performance of the Web application
Implement the latest best practices and conventions
As part of an agile development team, participate in the sprint planning meetings, daily stand ups and follow the agile development process
Review, refactor and maintain codebases
Ensure the quality of the delivered Web application and its code Profiling and improving front-end performance","3+ years of experience of experience building Applications with React and related ecosystem -Nest.Js would be desired-
Extensive knowledge in vanilla Javascript, EcmaScript 2015+ and Typescript
Strong knowledge of modern web technologies including HTML5, CSS3 (SAAS, LESS), JSX
Strong software engineering foundation
Ability to select and apply common development patterns, architectures, and best practices
Functional programming
Experience consuming and documenting REST APIs Good grasp of software architecture and scalability
Experience with automated and unit testing frameworks (Jest, Jasmine, Sinon, Enzyme, etc.).
End to end testing experience
UI metric collection and monitoring and feature flag experience.",https://www.getonbrd.com/empleos/programacion/react-frontend-developer-amuntalent-remote
Ejecutivo de Ventas en Frio,Venezuela,,Remoto,Junior,FULL_TIME,Comercial y Ventas,350.0,2023-07-03,44,Lique Digital,"['Customer Service', 'Sales']","Trabajaras en el área de ventas telefónicas, con el objetivo de agendar y conseguir clientes ofreciendo nuestros servicios de Marketing.
Inicialmente trabajaras a cargo del supervisor de ventas.","Excelencia en la atención al cliente
Capacidad de negociación
Comunicación y redacción de emails
Tener vocación de servicio y prever las necesidades del consumidor
Organizado y capaz de manejar su tiempo efectivamente
Responsabilidad, puntualidad y profesionalismo.",https://www.getonbrd.com/empleos/comercial-ventas/ejecutivo-de-ventas-en-frio-lique-digital-remote
Líder Técnico,Chile,Santiago,Híbrido,Senior,FULL_TIME,Programación,No hay información,2023-07-14,15,Finix Group,"['SQL', '.Net', 'React', 'Back-end', 'Tech Lead', 'Agile', 'JavaScript']","Trabajar en coordinación con el Product Owner de una célula ágil con foco de eficiencia operacional.
Participar en las reuniones de definición de requerimientos junto con el PO.
Estimar requerimientos definidos en conjunto con el PO.
Definir las tareas necesarias a realizar para cumplir con los requerimientos del sprint.
Desarrollar junto con los desarrolladores de la célula los requerimientos levantados por el negocio y priorizados por el PO.
Liderar, coordinar y resolver problemas técnicos con el equipo de desarrolladores.
Definir y aplicar las mejoras prácticas y estándares de desarrollo de software alineado con las definiciones del arquitecto, asegurando la calidad, eficiencia y consistencia de los desarrollos e implementaciones.
Proporcionar mentoría al equipo de desarrollo de la célula fomentando su crecimiento y desarrollo de habilidades y capacidad técnica.
Evaluar y tomar decisiones técnicas más adecuadas para cumplir con los requerimientos del negocio.
Coordinar con el equipo de producción la correcta implementación de las liberaciones.
Definir y realizar las validaciones necesarias de cada desarrollo de cara al paso a producción.
Monitorear y guiar a los desarrolladores para que cumplan con las tareas del sprint.","Mínimo 4 años de experiencia desarrollando software.
Conocimiento profundo de los principios de desarrollo de software y buenas prácticas de codificación.
Experiencia en migración de sistemas.
Conocimiento de metodologías agiles.
Conocimiento SQL Server avanzado, Net Framework 4.5 en adelante, Implementación de WS y APIS en .NET Entity Framework. React funtional.",https://www.getonbrd.com/empleos/programacion/lider-tecnico-finix-group-santiago
Sub Gte Adj de Adm. de Riesgo Operativo,Perú,Lima,Híbrido,Semi Senior,FULL_TIME,Ciberseguridad,No hay información,2023-07-19,9,BCP,"['Scrum', 'Agile', 'Cybersecurity', 'Cybersecurity certifications']",,,https://www.getonbrd.com/empleos/cybersecurity/sub-gte-adj-de-adm-de-riesgo-operativo-bcp-lima
Programador Jr Marketing Cloud Salesforce,Chile,Santiago,Híbrido,Junior,FULL_TIME,Programación,No hay información,2023-08-02,14,MATCH · Agencia-consultora,"['SQL', 'HTML5', 'Marketing', 'CSS', 'CRM', 'Salesforce', 'JavaScript', 'Cloud']","Buscamos un Programador Junior altamente motivado y apasionado por la tecnología, con ganas de aprender y desarrollarse en el área de Marketing Cloud con Salesforce. En este rol, serás responsable de la gestión y operación de diferentes módulos en la herramienta de Salesforce Marketing Cloud para el envío de comunicación personalizada a través de medios propios (mailings, push y sms).
Funciones adicionales asociadas a la operación de Marketing Cloud:
Participar en la configuración y prueba de envíos de mails para las comunicaciones.
Construir audiencias utilizando filtros y querys en la herramienta, basadas en los maestros de datos vinculados.
Desarrollar creatividades dinámicas para los mailings utilizando código AMPSCRPIT.
Apoyar en la configuración de HTMLs para los mailings.
Colaborar en la implementación de automatizaciones de audiencias y flujos en Salesforce Marketing Cloud.
Trabajar en conjunto con el equipo de negocio para personalizar el contenido de los envíos (asunto en emails, cupones específicos, footers, etc.).
Aprender y compartir las mejores prácticas para la implementación de acciones en medios propios.
Realizar seguimiento de la agenda de campañas a implementar, considerando las diferentes contrapartes en el flujo de envío de comunicación.
Responsabilidades:
Participar en el desarrollo e implementación de campañas de marketing utilizando Salesforce Marketing Cloud.
Contribuir en la creación y optimización de correos electrónicos y comunicaciones automatizadas.
Colaborar con el equipo de Marketing para asegurar la entrega efectiva de mensajes y la generación de leads.
Ayudar en la administración y mantenimiento de la plataforma Salesforce Marketing Cloud.
Realizar pruebas y depurar problemas técnicos para garantizar la calidad y la entrega adecuada de las comunicaciones.","Formación en Informática, Diseño y desarrollo web, o carreras afines.
Conocimientos básicos de programación en lenguajes como JavaScript, HTML y CSS (la experiencia en AmpScript o SQL no es excluyente, ¡estamos dispuestos a enseñarte!).
Interés genuino en aprender y crecer en el área de Marketing Cloud con Salesforce.
Habilidades de resolución de problemas y atención al detalle.
Capacidad para trabajar en equipo y comunicarse efectivamente con diferentes áreas.",https://www.getonbrd.com/empleos/programacion/programador-junior-de-marketing-cloud-con-sal-match-agencia-consultora-santiago
Líder Técnico Ionic/angular,Chile,,Remoto,Senior,FULL_TIME,Programación,2550.0,2023-06-12,69,Accenture,"['AngularJS', 'CSS', 'React', 'Ionic', 'API', 'Tech Lead', 'User Testing', 'TypeScript', 'JavaScript', 'Angular', 'Java', 'Front-end', 'Spring Boot']","¿Cuáles son las funciones del cargo?
Ejercer como líder técnico en el equipo de desarrollo
Crear estrategias de arquitectura orientada a microservicios
Ayudar y liderar a la célula de desarrollo en sus soluciones","¿Cuáles son los skills deseados?
Ionic/Angular (skill más importante y excluyente)
Spring Boot
React
JavaScript
TypeScript
CSS y Sass
Consumo de APIs REST
Control de versiones
State Management en React
Testing
Fundamentos de Web Development
SDK de Ionic",https://www.getonbrd.com/empleos/programacion/lider-tecnico-accenture-remote
Back-end Developer Node.js,Chile,Santiago,Híbrido,Semi Senior,FULL_TIME,Programación,2600.0,2023-07-20,62,ARKHO,"['Node.js', 'Continuous Integration', 'Virtualization', 'Docker', 'Microservices', 'Jenkins', 'Jest', 'Cypress', 'Back-end', 'User Testing', 'TypeScript', 'English', 'JavaScript', 'Testing Frameworks']","Estamos en busca de un desarrollador Fullstack con enfoque Node.js en el backend, para incorporarse a nuestro equipo ágil de proyectos y operación en la nube. Este perfil será parte de un equipo de proyecto que atenderá diferentes necesidades de nuestros clientes y que libera constantemente entregas y mejoras a las plataformas en la nube. Este perfil tendrá muchos retos de aprendizaje sobre tecnologías en la nube, que requerirán esfuerzo y metas de certificación. Además de desarrollar, debes ser un excelente técnico y querer tomar responsabilidades de proyectos. El desafío constante es desplegar continuamente servicios y productos más rápidos, seguros, escalables y robustos en un ecosistema en la nube (de facto) con procesos de automatización evolutivos. Nos gusta conformar equipos colaborativos y auto-gestionados, por lo que las habilidades de comunicación y responsabilidad son muy importantes. ¡Buscamos profesionales de excelencia e íntegros dentro y fuera de la cancha!","Experiencia de al menos 3 años en proyectos de desarrollo de software. En tu carrera profesional deberías contar al menos con:
Dominio framework Nestjs para Node.js
Conocimiento en Typescript
Experiencia en desarrollos e integraciones y comunicación con diferentes APIs.
Conocimiento en arquitectura de microservicios
Conocimientos de Docker y Jenkins
Dominio de herramientas de testing como Jest y Cypress.
Adherencia a buenas prácticas de desarrollo, incluyendo el uso de patrones de diseño, código limpio y mantenible.
Habilidades de resolución de problemas, capacidad para aprender nuevas tecnologías y colaboración en equipo.
Dominio de motores de base de datos, relacionales y documentales.
Inglés: Intermedio.",https://www.getonbrd.com/empleos/programacion/full-stack-developer-arkho-remote-9155
Analista Desarrollador (ASP.NET/C#),Chile,Santiago,Presencial,Senior,FULL_TIME,Programación,1600.0,2023-05-04,30,UltraEmpresa,"['SQL', 'C#', 'AngularJS', 'HTML5', 'C', '.Net', 'CSS', 'MVC', 'Git', 'Azure', 'React', 'API', 'REST API', 'Back-end', 'Agile', 'Cloud Computing', 'JavaScript', 'Cloud', 'Angular', 'Front-end', 'Software Analyst']","Nuestro enfoque principal es proporcionar soluciones tecnológicas innovadoras y eficaces para ayudar a nuestros clientes a mejorar su productividad, eficiencia y rentabilidad. Nos destacamos por nuestra experiencia y conocimientos técnicos en la creación de software para satisfacer las necesidades específicas de cada cliente.
Las funciones principales del analista FullStack que buscamos, incluyen el diseño, desarrollo y mantenimiento de aplicaciones web personalizadas. Es decir, estar a cargo de trabajar en todas las fases del ciclo de vida del software, desde la definición de los requisitos, hasta la implementación y el mantenimiento del mismo.
Desarrollar y mantener el software ERP utilizando conocimientos de FrontEnd y BackEnd: ASP.NET Framework, C#, SQL Server, HTML, CSS, Bootstrap, Javascript.
Debes ser capaz de Identificar y solucionar problemas en el sistema, realizando pruebas y ajustes para mejorar el rendimiento y la seguridad de la aplicación.
Colaborar con el equipo de desarrollo, participando en reuniones y aportando soluciones para mejorar el proceso de mantención y desarrollo de la calidad del software.
Si te unes a nuestro equipo, tendrás la oportunidad de trabajar en proyectos desafiantes y emocionantes, y de desarrollar tus habilidades y conocimientos en un entorno de trabajo dinámico y en constante evolución. Esperamos conocer a candidatos entusiastas y motivados que estén interesados en formar parte de nuestro equipo de profesionales de primer nivel.","Conocimiento avanzado de ASP.NET Framework y C#: Esperaríamos que un candidato tenga experiencia en la creación de aplicaciones web escalables y seguras utilizando ASP.NET Framework y C#. También sería deseable que tuviera conocimientos avanzados en patrones de diseño como Inyección de dependencias, Repository pattern, etc. para poder crear aplicaciones robustas y fáciles de mantener.
Tener experiencia en el diseño y desarrollo de bases de datos utilizando SQL Server. Sería importante que tenga conocimientos en la creación de consultas avanzadas, programación de procedimientos almacenados, y uso de herramientas como SQL Server Management Studio o Azure Data Studio.
Buen conocimiento de tecnologías Frontend como HTML, CSS y Javascript para poder crear interfaces de usuario atractivas y funcionales. Además, también sería beneficioso si tiene experiencia en el uso de alguna librería de Javascript como React o Angular.
Experiencia en el desarrollo de aplicaciones web con arquitectura MVC (Model-View-Controller) o MVVM (Model-View-ViewModel). Esto les permitiría crear aplicaciones escalables y fáciles de mantener.
Sería importante que un candidato tenga experiencia en el desarrollo de aplicaciones RESTful utilizando ASP.NET Web API o alguna otra tecnología similar.
Saber usar herramientas de control de versiones como Git, ya que esto les permitiría colaborar con otros desarrolladores en proyectos de equipo.
Conocimiento en buenas prácticas de programación y patrones de diseño, ya que esto les permitiría desarrollar aplicaciones escalables y fáciles de mantener.
Capacidad para trabajar de manera colaborativa en equipos de desarrollo ágiles, donde se espera una comunicación constante y colaboración entre los miembros del equipo.
Además de estos conocimientos técnicos, también valoramos habilidades interpersonales como la capacidad para comunicarse de manera efectiva, el trabajo en equipo, la capacidad de resolver problemas y el aprendizaje continuo. Buscamos a alguien que tenga la capacidad de adaptarse a diferentes proyectos y tecnologías, así como la voluntad de aprender y mejorar constantemente.",https://www.getonbrd.com/empleos/programacion/analista-desarrollador-asp-net-framework-c-ultraempresa-santiago
