Title,Country,City,Job_type,Job_level,Mode,Area,Salary,Date,Applicants,Company,Skills,Functions,Requirements,URL
Desarrollador Back-end,Chile,Santiago,Híbrido,Junior,FULL_TIME,Programación,1750.0,2023-06-29,258.0,Manager Software,"['Python', 'Full-stack', 'Back-end', 'JavaScript']","· Desarrollar interfaces de usuarios interactivas y responsivas utilizando React, JavaScript, TypeScript.
· Traducir diseños y especificaciones en JavaScript, TypeScript.
· Colaborar con diseñadores y desarrollodadores Backend para implementar funcionalidades y mejorar la experiencia de usuario.
· Realizar testing para garantizar el correcto funcionamiento de la plataforma, manteniendo y actualizando los desarrollos.
· Trabajar en equipos con otros desarrolladores y equipos de proyectos para generar valor en nuevas funcionalidades de la plataforma.
· Investigar y mantenerse actualizado sobre las nuevas tecnologías y herramientas que puedan mejorar la eficiencia y calidad de la plataforma.","Residencia en Chile
Experiencia demostrable como desarrollador Backend/Fullstack.
Conocimientos solidos en lenguaje de programación como JavaScript, Python.
Habilidades de comunicación y trabajo de equipo.
Ser autodidacta con capacidad de gestionar tiempos.",https://www.getonbrd.com/empleos/programacion/desarrollador-back-end-manager-software-santiago
Desarrollador .NET,,,Remoto,Semi Senior,FULL_TIME,Programación,1900.0,2023-03-27,381.0,Rialis Software,"['HTML5', '.Net', 'CSS', 'MVC', 'Git', 'Bootstrap', 'React', 'API', 'Full-stack', 'Back-end', 'Agile', 'JavaScript']",,,https://www.getonbrd.com/empleos/programacion/desarrollador-net-rialis-software-remote
Desarrollador Full-Stack,Chile y Perú,,Remoto,Semi Senior,FULL_TIME,Programación,2400.0,2023-05-16,294.0,Asesoría y Gestión de Procesos S.A,"['SQL', 'Node.js', 'C#', 'C', 'Git', 'Azure', 'Full-stack', 'Back-end', 'Cloud Computing', 'JavaScript', 'Cloud']","Implementación y mejora continua de las aplicaciones de las distintas iniciativas priorizadas por negocio y tecnología.
Análisis de Requerimientos y Necesidades, buscando el mejor mecanismo para completar los requerimientos de desarrollos, o modificaciones de software.
Seguir lineamiento y colaborar con buenas prácticas de las áreas técnicas (Arquitectura, Desarrollo, QA, Datos).",,https://www.getonbrd.com/empleos/programacion/desarrollador-full-stack-asesoria-y-gestion-de-procesos-s-a-santiago
Android Developer SSR,Chile,,Remoto,Semi Senior,FULL_TIME,Desarrollo Mobile,No hay información,2023-06-12,33.0,Accenture,"['Android', 'Kotlin', 'Mobile development']","¿Cuáles son las funciones del cargo?
Como desarrollador Mobile, deberás diseñar, crear y configurar aplicaciones para cumplir con los requisitos de aplicaciones y procesos comerciales en Anroid, específicamente con Kotlin.","¿Cuáles son los skills que necesito para este desafío?
Poseer experiencia de 1/2 años como desarrollador mobile, específicamente con Android.
Poseer experiencia utilizando herramienta Kotlin (excluyente)",https://www.getonbrd.com/empleos/desarrollo-mobile/android-developer-ssr-accenture-remote
Ruby on Rails Developer,4 ubicaciones,,Remoto,Semi Senior,FULL_TIME,Programación,No hay información,2023-07-31,16.0,Modyo,"['Ruby', 'Ruby on Rails', 'Virtualization', 'Docker', 'Amazon Web Services', 'Kubernetes', 'Back-end', 'Cloud Computing', 'English', 'Cloud']","Trabajarás en un equipo de desarrolladores de mucho seniority que no sólo disfrutan resolviendo problemas interesantes, sino que también les apasiona aprender y compartir conocimientos con otros Modyanxs.
Serás partícipe y parte del desarrollo de nuestra plataforma de Experiencia Digital Next-Gen, buscando elevar continuamente el nivel de nuestras prácticas de ingeniería. Trabajamos creando un producto y nuestros usuarios están en el centro de todo lo que hacemos. Siendo parte de nuestra área de Plataforma, el alcance del proceso de desarrollo se aplica a todo el software producido.
Algunas de tus responsabilidades serán:
Desarrollo de sistemas de diversa complejidad
Participación del análisis de requerimientos, diseños físicos, diseños lógicos y ejecución tareas de programación, testing y deployment.
Trabajo en equipo con otros desarrolladores y diseñadores en proyectos de diversa naturaleza y dimensión.","Más de 3 años de experiencia trabajando con Ruby on Rails (RoR).
Idealmente con experiencia trabajando con tecnologías de contenedores (Docker, Kubernetes, entre otras).
Nivel avanzado de inglés.
Idealmente experiencia en la nube de AWS (RDS, ECS, S3, etc.).
Idealmente con conocimientos de identidad y autenticación, OpenID Connect, OAuth y temas de seguridad.",https://www.getonbrd.com/empleos/programacion/ruby-on-rails-developer-modyo-remote-2d6b
Analista QA Senior,Chile,Santiago,Presencial,Senior,FULL_TIME,SysAdmin / DevOps / QA,2300.0,2023-07-21,10.0,KDU Ingeniería,"['SQL', 'QA', 'Selenium', 'API', 'TDD', 'Jira', 'Automation', 'Testing Frameworks']","Analista QA Senior, para integrarse a nuestra área de desarrollo, en donde deberá realizar las siguientes funciones:
Análisis, diseño y ejecución de plan de pruebas.
Automatización de pruebas.
Documentación relacionada al ciclo de pruebas completo.
Revisar especificaciones para levantar problemáticas y/o riesgos de forma temprana
Establecer procesos de mejora continua en relación al QA del software desarrollado
Confeccionar una ""base de datos de errores conocidos"" de tal manera que los desarrollos futuros no cometan los mismos errores
Implantar proceso/sistema de reporte y seguimiento de incidencias
Colaborar de forma constante con el equipo de desarrollo tanto en el diseño de la solución como en el desarrollo
En nuestra empresa valoramos a las personas autónomas, con iniciativa, responsables, con habilidades de comunicación, que puedan trabajar en equipo, aprender nuevas tecnologías y participar en el desarrollo de soluciones innovadoras, impulsando la mejora continua en el ámbito tecnológico.","Titulado o Egresado de Ingeniería en informática o carrera afín
Al menos 5 años de experiencia como analista QA sobre aplicaciones web
Manejo de herramientas de automatización de pruebas (Selenium, JMeter, etc)
Conocimiento acabado en el uso de sistemas de seguimiento de incidentes (JIRA, Zendesk, Freshworks, Trello, etc).
Experiencia en pruebas de servicios web (SOAP & REST)
Manejo de bases de datos (consultas SQL, nivel intermedio)",https://www.getonbrd.com/empleos/sysadmin-devops-qa/desarrollador-back-java-aws-kdu-ingenieria-santiago-3ca3
Desarrollador Lider RPA Power Automate,Colombia,,Remoto,Semi Senior,FULL_TIME,Programación,2450.0,2023-07-25,26.0,Sophos Solutions,"['JSON', 'HTML5', 'CSS', 'Power BI', 'Automation', 'Tech Lead', 'JavaScript', 'Software Architect', 'Software Analyst', 'Machine Learning Engineer', 'Microsoft SharePoint', 'Data Visualization', 'BPMN']","Integración y desarrollo de diversos procesos de negocio con BPMN
Colaboración con diferentes proyectos y unidades de negocio, en proyectos de automatización de procesos y flujos de trabajo.
Oportunidad de proponer nuevas tecnologías y soluciones.","3 a 4 años de experiencia como: Desarrollador RPA, RPA Developer, Tech Lead Automatización, RPA Architect, RPA Specialist, Power Platform Developer, Desarrollador Power Apps, Ingeniero Power Automate, Desarrollador Microsoft, programador Dynamics 365, SharePoint, programador power Platform, power Platform developer, programador power apps, power Flow developer, analista programador Microsoft.
Conocimientos en modelado de procesos con notación BPMN, análisis de negocio y procesos, levantamiento de requerimientos.
Administración y liderazgo de equipos, enfocado en crear ambientes colaborativos, programas de formación, desempeño y hands on, sin temor de integrarse el equipo y codificar.
Conocimientos en desarrollo con Power Platform . Buen nivel de dominio sobre las tecnologías Power BI, Power Apps, Power Automate, Microsoft Graph, Conocimiento de desarrollo front End con HTML, CSS, Javascript y librerías JSON
Experiencia en soluciones de automatización como Automation Anywhere y UiPath con Conceptos de hyper automatización. RPA, RDA, Chatbots, OCR, OMR, ICR, Conocimientos de ML.",https://www.getonbrd.com/empleos/programacion/desarrollador-lider-rpa-power-automate-remoto-sophos-solutions-remote
Data Engineer / Scientist,,,Remoto,Semi Senior,FULL_TIME,Data Science / Analytics,No hay información,2023-07-24,126.0,Hi Auto,"['Python', 'Data Science', 'PyTorch', 'Back-end', 'Data Engineer', 'Data Analysis', 'Machine Learning Engineer']","● Analyze the data aggregated at different points in the company’s data
pipeline and create automated tools to detect and fix problems.
● Understand the operation of the different teams interacting with the
data and maintain and improve the tools and processes they use to
interact with it.
● Work hand in hand with the senior ML engineers and analyze the ML
algorithms results to detect faults/improvement suggestions in the
data creation and devise the strategies for solutions.
● Step by step, take ownership of different components of the pipeline
including training models.","● MSc degree in Computer Science or equivalent industry experience (4 years). MUST
● 4+ years of hands-on work experience in the Data Science / ML industry.
● Strong data analysis skills
● Strong SW development skills, especially in Python MUST
● Knowledge of at least one of the major frameworks
(Tensor Flow/PyTorch) MUST
● Organized
● Qualities: Star performer, Team player, Fast, Strong ownership,
Passionate about their work, and a great communicator.",https://www.getonbrd.com/empleos/data-science-analytics/data-engineer-scientist-hi-auto-remote
Ingeniero de Software,Chile,Santiago,Híbrido,Semi Senior,FULL_TIME,Programación,2750.0,2023-07-28,71.0,First Rate Chile/Finantech,"['Ruby', 'Python', 'MVC', 'Git', 'Back-end']","En Finantech buscamos una persona análitica y proactiva que apoye los proyectos actuales de nuestra área de desarrollo. Buscamos a alguien que forme parte del equipo tanto en la identificación de problemas, como en la modelación, diseño e implementación de sus soluciones.
En este proyecto, algunas de las tareas a llevar a cabo son:
Diseño e implementación ágil de soluciones robustas
Desarrollo de aplicaciones web con RoR (tanto internas como de cara a clientes)
Procesamiento y extracción de datos de distintos tipos de fuentes (pdf's, sitios web, csv's, bbdd, etc)
Automatización de procesos internos","Haber estudiado o estar estudiando Ingeniería Civil Informática, en Computación, TI, o alguna otra carrera afín
Al menos 2 años de experiencia programando con un lenguaje de alto nivel como Ruby o Python
Experiencia usando el patrón de arquitectura de software MVC y con Frameworks de desarrollo web
Manejo de bases de datos relacionales
Manejo de GIT
Ganas de trabajar y aprender junto a un gran equipo de ingenieros de software",https://www.getonbrd.com/empleos/programacion/ingeniero-de-software-first-rate-chile-finantech-santiago
Full-Stack Developer Inglés Avanzado,Chile,,Remoto,Semi Senior,FULL_TIME,Programación,No hay información,2023-07-12,45.0,Kibernum,"['NoSQL', 'C#', 'AngularJS', 'C', 'Trafficker', 'MongoDB', 'React', 'Microservices', 'Full-stack', 'Back-end', 'English', 'JavaScript', 'Angular', 'Java', 'Front-end']","· El proyecto está basado en permitir la experiencia de última generación al cliente, dándole acceso a servicios bancarios en tiempo real directamente desde sus aplicaciones, por medio de integración continúa con sus pagos y toda su información, ERP y otros sistemas financieros.
· Proveerá a los clientes con una gran variedad de API capaces de permitir a los clientes gestionar sus pagos globales, regionales y locales y sus actividades de pagos diarias.
· El candidato adecuado demostrará claramente sus habilidades de mejorar la integración continua dará mejora a las áreas de proceso.
· Se requiere que el candidato revise el trabajo diario, asegurando un buen proceso de implementación, identificando riesgos y trabajando en la mitigación de riesgos.
· Deberá diseñar, desarrollar, testear e implementar las soluciones de software usando las apropiadas tecnologías stack.
· Trabajar proactivamente e independientemente los requerimientos de los proyectos, y articulará adecuadamente los procesos de riesgo de cada proyecto.
· Entregará experticia en el análisis técnico y resolverá los problemas durante el proyecto.
· Debe manejar el ciclo de vida del desarrollo del software.","· Carrera a fín titulado
· Inglés avanzado
· 4 a 5 años de experiencia en desarrollo full stack en aplicaciones transaccionales en tiempo real de alto volumen y tráfico.
· Amplio conocimiento en las últimas herramientas tecnológicas de React.JS, Angular JS, C#, Java, XML, MongoDB, Couchbase DB, Microservicios.
· Experiencia liderando equipos pequeños y proyectos propios reportando a jefatura senior.
· Experiencia elaborando soluciones bajo Metodología Ágil.
Siempre dispuesto a aprender sobre nuevas tecnologías.
· El candidato debe tener buenas habilidades de comunicación y ser capaz de liderar equipos pequeños.
· Capacidad de trabajar eficientemente en todo tipo de situaciones y ser entusiasta en darle calidad a los productos con las mejores herramientas, procesos y personas.
· Debe tener demostrable conocimiento técnico con experiencia en diseño y desarrollo de aplicaciones.",https://www.getonbrd.com/empleos/programacion/fullstack-developer-ingles-avanzado-kibernum-remote-7459
Desarrollador Back-end,Chile,,Remoto,Semi Senior,FULL_TIME,Programación,3200.0,2023-07-10,69.0,Fintech de Chile,"['Virtualization', 'MVC', 'Git', 'Azure', 'Microservices', 'Amazon Web Services', 'Kubernetes', 'Back-end', 'Cloud Computing', 'Cloud', 'Java', 'Spring Boot', 'Spring cloud']","¿A qué proyectos se le asignará?
Proyectos de desarrollo de SW en el sector financiero.
¿Con qué otros roles o personas le tocará trabajar?
Con los analistas funcionales de la empresa y contrapartes técnicas del cliente.
Funciones específicas:
Recibir requerimientos funcionales de los analistas de requerimientos de Derivatik
Desarrollo de microservicios
Pruebas unitarias
Deployment en la nube
Soporte y bug fixing","Conocimientos y Experiencia en Spring Boot
Formación de ingeniero en computación
Conocimientos y experiencia en arquitectura de microservicios (spring cloud, kubernetes u otro), bajo el patrón arquitectónico de MVC
Conocimientos y experiencia en despliegue cloud (Amazon, Google, Azure o similar)
Control de fuentes con git; bajo git flow
Conocimientos en deployment continuo y delivery continuo en herramientas tales como Aws Code Deploy/Code Pipeline o equivalente",https://www.getonbrd.com/empleos/programacion/desarrollador-back-end-derivatik-spa-remote-0a87
Analista QA,Chile,Santiago,Híbrido,Semi Senior,FULL_TIME,SysAdmin / DevOps / QA,No hay información,2023-06-06,61.0,SMU S.A.,"['QA', 'Git', 'TDD', 'Jest', 'Postman', 'Agile', 'JavaScript', 'Github', 'Page Object Model']","Realizar el diseño, codificación y ejecución de plan de pruebas de software; manuales y automatizadas, documentación y versionamiento.
Realizar el diseño e implementación de un roadmap tecnológico para automatizar y robotizar la mayor cantidad de las pruebas.
Controlar y revisar los aspectos críticos de la calidad del software, tanto para web como mobile, a través de las herramientas y criterios correspondientes, optimizando tiempos de entrega.
Coordinar el trabajo en estrecha colaboración con otras funciones dentro del equipo en línea, diseño, experiencia de usuario, desarrolladores, soporte operativo y equipos fuera del grupo en línea, como equipos de marketing y campañas.
Coordinar y supervisar los procesos de prueba y mejora de cada uno de los productos, tanto con los propietarios como con el grupo de pruebas, utilizando técnicas de prueba predominantemente UAT.","- Formación: Ingeniero ejecución informática, Ingeniero Civil Computación, Informática o carrera afín.
- Experiencia como ingeniero de QA en células de desarrollo para desarrollo de productos mobile y web.
- Experiencia mínima de 2 años, utilizando metodologías ágiles, procesos de certificación y automatización de pruebas.
- Experiencia en certificación de App Mobiles, desarrollo web, ecommerce, medios de pago e integraciones.
- Experiencia en pruebas end to end.
- Experiencia en pruebas de performance: de carga, de estrés, endurance, de picos, de volumen, de escalabilidad
- Conocimiento en los siguientes Stack tecnológicos o similares:
POM (Page object model), Javascript, Git, Github Actions, Playwright, WebdriverIO, Jest, Postman o RapidApi.
Saber escribir tests con SWA (Should When And) y AAA (Arrange, Act y Assert).
Cononcer GHERKIN (Given When Then And).",https://www.getonbrd.com/empleos/sysadmin-devops-qa/analista-qa-smu-s-a-santiago
Data Analyst,Chile,Santiago,Híbrido,Semi Senior,FULL_TIME,Data Science / Analytics,No hay información,2023-06-06,257.0,BICE VIDA,"['SQL', 'Python', 'R', 'Big Data', 'Back-end', 'Agile', 'Data Analysis']",,"✔️ Estudio pre-grado de Ingeniería Civil, Matemáticas/Economía/ Estadísticas o similar.
✔️ Al menos 1 año de experiencia desarrollando análisis estratégico.
✔️ Dominio de herramientas de extracción de datos (SQL)
✔️ Dominio de programación estadística (R o Python)
✔️ Deseable experiencia de trabajo con equipos ágiles y de alto desempeño.
✔️ Deseable experiencia previa en trabajando en industrias o rubros de seguros, o trabajando con productos de esa línea.",https://www.getonbrd.com/empleos/data-science-analytics/data-analyst-bice-vida-santiago
Líder de Estrategia,Chile,Santiago,Híbrido,Senior,FULL_TIME,"Producto, Innovación y Agilidad",2400.0,2023-07-18,29.0,BNP Paribas Cardif,"['Ingeniero Comercial', 'English']","Hoy buscamos a un Líder de Estrategia que se sume al equipo de la Gerencia de Estrategia y Transformación.
Tú misión será asegurar el cumplimiento de la estrategia y propuesta valor compañía para colaboradores, clientes, socios y accionistas, liderando la generación de objetivos (estratégicos y tácticos) en los distintos niveles, junto a sus métricas asociadas.
Gestionar los proyectos estratégicos de la compañía y apoyar en la priorización de iniciativas requeridas para el cumplimiento de objetivos.
¿Cuáles son los principales desafíos del cargo?
• Apoyar y conducir el proceso de planificación estratégica.
• Alinear la estrategia de las distintas áreas de la compañía en los diferentes campos de acción que permitan asegurar el logro de los objetivos.
• Liderar proyectos estratégicos alineados con los objetivos y estrategias definidas
• Velar por el cumplimiento de la propuesta de valor para clientes, colaboradores, socios y accionistas.
• Definir y gestionar indicadores que permitan hacer seguimiento a la implementación de la estrategia y la propuesta de valor.
• Diseñar instancias de comunicación de la estrategia y propuesta de valor a todos los niveles de la compañía.","¿Cómo saber si hago match con esta vacante? Buscamos a alguien que:
-Formación: Profesional de referencia Ingeniero Civil Industrial, Ingeniero Comercial o carrera a fin. -Experiencia requerida: Experiencia de 2 o más años liderando equipos multidisciplinarios y haciendo seguimiento a proyectos e iniciativas en empresas del sector financiero (bancos, compañías de seguros, AFP, fondos mutuos o similares). -Deseable: Experiencia gestionando proyectos, realizando trabajos de análisis de información, reportes e indicadores de gestión. -Manejo inglés: Nivel intermedio-avanzado – excluyente (se evaluará en el proceso de selección). ",https://www.getonbrd.com/empleos/innovacion-agilidad/lider-de-estrategia-bnp-paribas-cardif-santiago
QA Engineer,Chile,Santiago,Híbrido,Semi Senior,FULL_TIME,SysAdmin / DevOps / QA,2700.0,2023-05-12,61.0,Smith,"['Agile', 'English', 'QA Engineer']",,,https://www.getonbrd.com/empleos/sysadmin-devops-qa/qa-engineer-ingles-intermedio-smith-santiago
Senior Front-end Developer,,,Remoto,Senior,FULL_TIME,Programación,4500.0,2023-07-05,185.0,MoneyMade,"['React', 'Agile', 'TypeScript', 'JavaScript', 'Front-end']","• Actively contribute to agile sprint and technical planning design, QA testing and product release processes
• Contribute to the ongoing improvement of the team’s processes and development practices
• Design and develop software wireframes, mockups and user-experience flow with and translate them to technical requirements
• Understand the nuances in software to identify (and remove) blockers from the development process","4 years or more of Front End engineering experience
4 year or more building frontend using React/NextJs/Typescript
2 year or more employed fully remotely by international companies (desirable experience in startup company)
Strong problem-solving skills to accelerate our efforts to think and plan strategically
Self-motivated, goal-driven and execution-oriented
Ability to work across multiple product lines with a variety of stakeholders to achieve your objectives
Experience working in fast-paced, high-accountability, agile environments",https://www.getonbrd.com/empleos/programacion/senior-front-end-developer-moneymade-remote
Consultor Técnico / Desarrollador de Software,,,Remoto,Senior,FULL_TIME,Programación,2000.0,2023-06-20,28.0,Perfaware Chile SPA,"['JEE', 'Oracle', 'Jira', 'Back-end', 'English', 'Java', 'Software Developer', 'Linux', 'UNIX']","Identifique los requisitos comerciales a partir de la documentación y las reuniones del cliente.
Desarrolle opciones de alto nivel para que el cliente optimice las operaciones comerciales en función de las capacidades del Sistema
Documente casos de usuario/casos de prueba basados en los requisitos del cliente y los diseños de Bridge.
Identifique problemas y proponga recomendaciones que aprovechen todos los recursos apropiados de Bridge.
Construir consenso en grupos para las soluciones bridge propuestas.
Desarrolle productos de trabajo precisos y concisos que no requieran retrabajo.
Asesoramiento a clientes en integración de sistemas logísticos, mejores prácticas y tecnologías emergentes.
Diseñar procesos comerciales y técnicos para la integración de Sistemas.
Desarrollar documentación técnica sobre integración de procesos y tecnología.
Desarrollar estrategias y escribir libros blancos sobre las mejores prácticas de logística global.
Asesorar a los clientes sobre la arquitectura de toda la empresa y la integración con los componentes de la cadena de suministro.
Demuestra experiencia con software, servicios ,con metodologías y herramientas SDLC.
Mantiene y amplía el conocimiento técnico y comercial a través del estudio y la experiencia de entrega en el sitio.
Informa el tiempo y los gastos propios de manera precisa y oportuna.
Informa el propio progreso hacia los objetivos del proyecto articulados en la SOW. Escala las excepciones rápidamente al Gerente de Proyecto de Consultoría.
Representa a la empresa ante el cliente con profesionalidad en todo momento.",,https://www.getonbrd.com/empleos/programacion/consultor-tecnico-desarrollador-de-software-perfaware-chile-spa-remote
Business Intelligence Developer,México y Chile,,Remoto,Semi Senior,FULL_TIME,Programación,2450.0,2023-06-27,93.0,Destacame,"['Excel', 'Business Intelligence', 'SQL', 'Python', 'Power BI', 'Back-end', 'Tableau', 'Data Visualization']","Atender consultas sobre BI a todas las áreas de Destácame sobre diferentes BBDD.
Disponibilizar la información a distintas áreas de Destácame, estando en contacto con las contrapartes para dar a conocer los resultados.
Analizar requerimientos de contraparte de negocios en relación a la veracidad de datos.
Crear ETL y elaborar documentación para el desarrollo de algoritmos de procesamiento de datos.
Generar reportería/paneles/dashboards en Quicksight.
Mantener y actualizar procesos existentes.
Participar en la planificación y ejecución de iniciativas.
Apoyar en la creación de campañas según requerimiento.","Titulado de Ingeniería Civil Informática, Ingeniería Civil Industrial, Ingeniería en Control de Gestión, Ingeniería Comercial, Técnico en Informática o carrera afín.
2 años de experiencia en áreas de BI.
Manejo SQL y Excel Intermedio.
Manejo de lenguaje de programación Python.
Manejo de herramientas de BI (Power BI, Tableau).
Manejo de Quicksight.",https://www.getonbrd.com/empleos/programacion/business-intelligence-developer-destacame-remote-38e7
