Title,Country,City,Job_type,Job_level,Mode,Area,Salary,Date,Applicants,Company,Skills,Functions,Requirements,URL
Audiovisual Designer,Chile,Santiago,Híbrido,Junior,FULL_TIME,Diseño / UX,No hay información,2023-07-03,147.0,Healthatom,"['Marketing', 'Advertising', 'Web design', 'Audiovisual']","Crear videos y animaciones que potencien nuestros objetivos en anuncios publicitarios, plataformas web y redes sociales. Serás el encargad@ de cautivar y conectar con nuestra audiencia con tu talento y creatividad.
Utilizar tus habilidades de animación para dar vida a piezas gráficas para diferentes públicos y grupos de interés de nuestra empresa.
Capturar la esencia de nuestros diversos productos a través de grabaciones.
Realizar la postproducción de videos para asegurar que nuestras producciones audiovisuales sean de la más alta calidad.
Participar activamente en estrategias creativas del equipo de Marketing.","Diseñador o publicista, marketing, publicidad, comunicación.
Al menos 2 años de experiencia trabajando con material audiovisual.
Conocimiento en Motions Graphics, diseño multimedia o integral.
Conocimientos en manejo de cámaras profesionales de fotografía y video.
Manejo en la Suite de Adobe, especialmente After Effects.",https://www.getonbrd.com/empleos/diseno-ux/audiovisual-designer-healthatom-santiago
Sr. Software Engineer,,,Remoto,Senior,CONTRACTOR,Programación,No hay información,2023-07-24,84.0,Passport Shipping,"['MySQL', 'Redis', 'Node.js', 'AngularJS', 'Vue.js', 'Git', 'React', 'Express', 'Elasticsearch', 'REST API', 'Back-end', 'English', 'JavaScript', 'Cloud', 'Angular', 'Front-end', 'Web Service']","Solve synchronization and load issues of our distributed API
Create and optimize relational data queries collaborating with our data specialists
Implement effective scheduled data processing tasks with our internal Routines framework
Generate properly tagged log data and analyze it with Elasticsearch
Use the power of cloud-based AWS tools and Prometheus/Grafana monitoring
Enrich our fancy knowledge base in Notion with new details and articles
Learn about the world of international shipping
Deal with popular e-commerce platforms as Shopify, Bigcommerce, Magento
Understand our clients’ pain points and needs, collaborate with some of them directly to ensure the success
Be a part of a supporting team that will help you to adapt, improve and cope with failures","5+ years software development experience
A college graduate with a technical degree
Proficient in English reading and writing
Expertise with NodeJS, Express framework, MySQL, Redis, Git, Elasticsearch
Expertise with one of the following frontend frameworks: Angular / React / Vue
Experience in building distributed cloud-based REST API web services
Ability to communicate effectively and clearly and collaborate with other teams
Transparency and accuracy in task management
Fast adaptation to existing code styles, practices and conventions combined with the ability to take an active role in their continuous review and improvement
Work autonomy: skill of improving things with little guidance, but without any hesitation about clarifying questionable points
Accountability: You take ownership of your work, the answers you provide to others, and learn from your mistakes",https://www.getonbrd.com/empleos/programacion/sr-software-engineer-passport-shipping-remote
Desarrollador Tibco Junior,Chile,,Remoto,Junior,FULL_TIME,Programación,No hay información,2023-07-26,89.0,Accenture,[],,,https://www.getonbrd.com/empleos/programacion/desarrollador-tibco-junior-accenture-remote
🌎 Sr. Data Engineer,Chile,Santiago,Híbrido,Senior,FULL_TIME,Programación,No hay información,2023-05-25,31.0,Betterfly,"['MySQL', 'DevOps', 'Python', 'PostgreSQL', 'Virtualization', 'Matlab', 'Hadoop', 'R', 'Azure', 'Data Architecture', 'Amazon Web Services', 'Big Data', 'Apache Spark', 'Spark', 'Google Cloud Platform', 'Back-end', 'CI/CD', 'Cloud Computing', 'Data Engineer', 'Cloud', 'Machine Learning']",,"Título universitario o conocimientos y experiencia relevantes en ciencias de la computación, ingeniería informática o campos relacionados.
Experiencia en bases de datos (PostgreSQL, Redshift, MySQL).
Programación en Python.
Experiencia en servicios en la nube (deseable AWS, GCP, Azure).
Conocimiento de servicios sin servidor (por ejemplo, en AWS: Step Functions, Lambda, Glue).
Experiencia en el desarrollo de tuberías de datos en lotes y en tiempo real.
Conocimientos de DevOps (deseable).
Conocimientos en software estadístico (R, Stata, Matlab) y nociones de aprendizaje automático/IA (deseable).
Conocimientos en Big Data (Spark, Hadoop, Map Reduce) (deseable).",https://www.getonbrd.com/empleos/programacion/global-backend-developer-betterfly-santiago-lima-bogota-madrid-valencia-quito
QA Manager,,,Remoto,Semi Senior,FULL_TIME,SysAdmin / DevOps / QA,No hay información,2023-06-12,69.0,ZeroQ,"['QA', 'Cypress', 'Jira', 'Testing Frameworks']","El QA Manager de ZeroQ será el responsable de liderar y supervisar las actividades del equipo de QA para garantizar la calidad de todas las soluciones de software antes de su implementación y puesta en producción. Coordinará el diseño, la implementación y la ejecución de planes y estrategias de pruebas, y colaborará con el equipo de desarrollo para identificar, analizar y resolver problemas de calidad, con el objetivo de minimizar los defectos en la producción.
Será responsable de garantizar que todas las soluciones de software cumplan con los estándares de calidad establecidos. Esto implica la supervisión del equipo de QA, la implementación de planes y estrategias de pruebas, y la colaboración con otros equipos y partes interesadas para garantizar que se cumplan todos los estándares de calidad.","Además, este rol incluye la gestión de herramientas de pruebas y proyectos como Jira, Xray y Cypress para optimizar la eficiencia de las pruebas, así como el desarrollo y la ejecución de pruebas automatizadas. El QA Manager también proporcionará orientación y capacitación al equipo de QA, trabajará con otras partes interesadas para definir y cumplir con los estándares de calidad y ofrecerá retroalimentación constructiva al equipo de desarrollo y a la gerencia sobre la calidad del software y las posibles mejoras.",https://www.getonbrd.com/empleos/sysadmin-devops-qa/qa-manager-zeroq-remote
Analista de Sistemas,Perú,,Remoto,Senior,FULL_TIME,Programación,1950.0,2023-06-15,160.0,Soaint,['UML'],,,https://www.getonbrd.com/empleos/programacion/analista-de-sistemas-soaint-remote
Desarrollador TI,Chile,Santiago,Presencial,Semi Senior,FULL_TIME,Programación,1650.0,2023-07-21,11.0,Inmobiliaria Fundamenta,"['MySQL', 'SQL', 'PHP', 'Virtualization', 'Scrum', 'Amazon Web Services', 'Jira', 'Back-end', 'Agile', 'Cloud Computing', 'Cloud']"," · Adaptar los sistemas existentes a cambios en su ambiente productivo, implementando mejoras solicitadas por el usuario y realizando reingeniería del sistema para futuros usos. 
· Seleccionar y comprometer los requisitos que se completarán en cada iteración, manteniendo una comunicación fluida con el cliente y haciendo las preguntas necesarias para obtener claridad. 
· Identificar todas las tareas necesarias para completar cada requisito y garantizar su implementación eficiente. 
· Implementar pruebas de aceptación y pruebas unitarias para asegurar la calidad del software desarrollado. 
· Gestionar el Backlog de producto y llevar a cabo los desarrollos funcionales y operativos requeridos. · Estimar la complejidad y el esfuerzo necesarios para cada tarea, asegurando una planificación y ejecución efectivas.
· Participar activamente en los Daily Meetings, Sprint Planning Meetings, Sprint Reviews y Sprint Retrospectives. · Identificar posibles obstáculos y comunicarlos al Scrum Master para su resolución oportuna. ","Debe tener conocimiento demostrable en desarrollo de proyectos informáticos, controlar las versiones del proyecto y ser capaz de crear, modelar bases de datos. 
Asi también ser capaz de mantener desarrollos internos, desarrollando mejoras al software o resolviendo errores. 
 - Lavavel, PHP 
 - SQL Server, MySql
 - SCRUM
 - Jira
 - AWS (Ec2, RDS, s3, Lightsail, Codecommit) ",https://www.getonbrd.com/empleos/programacion/desarrollador-ti-inmobiliaria-fundamenta-santiago
Project Manager,Perú,Lima,Híbrido,Semi Senior,FULL_TIME,Operaciones / Admin,No hay información,2023-06-16,181.0,BCP,"['ITIL', 'Project Manager', 'Cybersecurity certifications']","Asegurar la correcta conciliación del consumo de de horas planificadas y ejecutadas de los servicios contratados.
Generar los reportes definidos para obtener la información de los consumos por cada servicio.
Cuestionar y analizar cualquier desviación de los consumos de acuerdo con el comportamiento histórico de cada servicio
Elaborar los reportes mensuales de los resultados de la conciliación del consumo y proyección de la demanda, que sirve de input para levantar observaciones y generar nuevas negociaciones.
Exponer los resultados del consumo y demanda en el comité respectivo que se tiene con los stakeholders.
Identificar y proponer mejoras en optimizar los tiempos, fuentes, etc. Del proceso.
Redefinir flujos y procedimientos que soporten la ejecución del proceso.",,https://www.getonbrd.com/empleos/operaciones-management/project-manager-bcp-lima-1958
Software Engineer,Chile,Santiago,Híbrido,Semi Senior,FULL_TIME,Programación,No hay información,2023-07-24,51.0,NeuralWorks,"['Python', 'Virtualization', 'Docker', 'Microservices', 'Kubernetes', 'SRE', 'Back-end', 'CI/CD', 'English', 'Cybersecurity', 'Machine Learning Engineer', 'UNIX']",,,https://www.getonbrd.com/empleos/programacion/software-engineer-neuralworks-santiago-b8a9
Desarrollador/a Aplicaciones Móviles,Chile,,Remoto,Senior,FULL_TIME,Desarrollo Mobile,2950.0,2023-06-14,24.0,WOM,"['Android', 'MVC', 'Git', 'Kotlin', 'Back-end', 'Mobile development', 'Java']","¡¡PORQUE NADIE TE DA MAS!!
¡Te invitamos formar parte de la Telco que la rompe en el mercado! Si eres una persona apasionada en lo que emprendes, lo haces desde la innovación y la honestidad, y con valentía al enfrentar los nuevos desafíos, ¡eres el/la futuro/a WOMer que buscamos!
Buscamos un(a) Desarrollador/a de Aplicaciones Móviles
Objetivo del Cargo:
El principal objetivo es crear, desarrollar, diseñar y probar nuevos programas o sistemas para garantizar su eficiencia, en base a los requerimientos del negocio
Principales Funciones
- Analizar los requerimientos de las áreas usuarias
- Evaluar aplicaciones nuevas y existentes
- Diseñar e implementar soluciones para posibles fallas en los aplicaciones existentes
- Elaboración de códigos en lenguajes especializados para nuevos programas y/o existentes.
- Participar de los procesos de pruebas de los nuevos programas
- Ejecutar el código para medir su eficiencia y/o reescribirlo para detectar errores
- Elaborar manuales operativos o documentar las especificaciones técnicas de las aplicaciones que se desarrollan.
- Dar soporte al producto que desarrollan (aplicaciones).","- Educación: ingeniero/a de sistemas, Ingeniero/a en computación e informática, Ingeniero/a de software.
- Al menos 2 años de experiencia en cargos similares
- Experiencia en Telco
- Desarrollo aplicaciones móviles nativas para Android (excluyente)
- GIT (excluyente)
- Java, Kotlin, Android Nativo, MVC, MVVM,",https://www.getonbrd.com/empleos/desarrollo-mobile/desarrollador-a-aplicaciones-moviles-wom-remote
QA Software Tester,México,Mexicali,Híbrido,Semi Senior,FULL_TIME,SysAdmin / DevOps / QA,No hay información,2023-03-13,18.0,Spark Technologies,"['SQL', 'QA', 'API', 'Functional QA']","You will be working at:
Test case planning, creation, and execution
Support in the planning and estimation of test cases.
Detect and document bugs.
Improvement of the life-cycle of the software.
Communication with the client.","We will need you to know:
Life-cycle project knowledge.
Versions management experience.
+1 year SQL experience
+2 years of experience with functional testing
Basic knowledge of API
We are looking for a proactive person that have the will to growth.",https://www.getonbrd.com/empleos/sysadmin-devops-qa/qa-software-tester-spark-technologies-mexicali
UX Writer Semi Senior,Chile,Santiago,Híbrido,Semi Senior,FULL_TIME,Diseño / UX,No hay información,2023-06-15,41.0,LeytonMedia,"['UX', 'Marketing', 'Advertising', 'Web design', 'CRM', 'Salesforce', 'Figma', 'Copywriting', 'Cloud']","- Participar activamente en las instancias de diseño generando contenidos atractivos y de calidad para las diferentes interfaces, principios de escritura UX, landings, mails, entre otras comunicaciones.
- Analizar e identificar dolores en los distintos Journeys del cliente, especialmente en la cadena de mails, siendo capaz de proponer y ejecutar estrategias que mejoren la experiencia del usuario.
- Facilitar y sintetizar procedimientos, transformándolos en textos breves y call to actions en las diferentes pantallas con las que interactúa el usuario.
- Asegurarse que las comunicaciones estén alineadas a la estrategia de contenido de todos los productos.
- Analizar los KPIs de conversión del contenido.","- Estudios en Marketing, Publicidad o Diseño con especialización en UX Design y/o UX Writing.
- Experiencia mayor a 5 años en la redacción de contenido creativo y atractivo en productos digitales.
- Contar con conocimientos de UX Design.
- Excelente gramática, sintaxis y capacidad de redacción creativa.
- Conocimientos en Figma.
- Experiencia trabajando con Salesforce Marketing Cloud.
- Altas habilidades interpersonales y de comunicación.",https://www.getonbrd.com/empleos/diseno-ux/ux-writer-semi-senior-leytonmedia-santiago
Diseñador UI/UX,,,Remoto,Semi Senior,FULL_TIME,Diseño / UX,2000.0,2023-03-24,506.0,EdiPro,"['Responsive', 'UX', 'HTML5', 'CSS', 'Scrum', 'Wireframes', 'User Research', 'UI Design', 'Agile', 'UX Researcher', 'Kanban']",,,https://www.getonbrd.com/empleos/diseno-ux/disenador-ui-ux-edipro-remote-f497
Senior Data Scientist,Colombia,Bogotá   Lima,Híbrido,Senior,FULL_TIME,Data Science / Analytics,3450.0,2023-08-02,56.0,Belcorp,"['SQL', 'Python', 'Virtualization', 'Git', 'Amazon Web Services', 'Data Science', 'Artificial Intelligence', 'Google Cloud Platform', 'Back-end', 'Cloud Computing', 'English', 'Cloud', 'Machine Learning', 'Machine Learning Engineer']",,,https://www.getonbrd.com/empleos/data-science-analytics/senior-data-scientist-belcorp-lima
Analista QA,Chile,,Remoto,Semi Senior,FULL_TIME,SysAdmin / DevOps / QA,No hay información,2023-07-13,163.0,Agilesoft SpA,"['QA', 'Postman', 'Functional Analyst']","Estamos en búsqueda de un Analista de QA, para integrarse a nuestra planta de trabajo de Santiago de Chile, a una célula de desarrollo ágil asignada a uno de nuestros clientes.
Responsable de realizar los análisis de documentos desde la perspectiva de certificación (aceptación funcional) para la gestión y otras partes interesadas.
Su propósito será:
Cumplir con los procesos de pruebas de calidad del área QA para la mejora continua en la calidad en todos los proyectos otorgados, siguiendo la estrategia de pruebas acordada.
Definir y crear el plan de pruebas.
Analiza la documentación funcional y no funcional y genera los casos de prueba.
Ejecución de casos de prueba.
Reporte de bugs e incidencias en Jira-Zephyr (herramienta oficial)
Validación de incidencias solucionadas
Aprobar criterios de entrada/salida a ser utilizados en las pruebas (Datos de prueba y resultados esperados).
Validar los resultados de las pruebas y asegurar que se satisfagan los criterios de entrada y salida para caso de prueba.
Desarrollar los casos de prueba y las condiciones de prueba, así como los resultados esperados para el (los) plan(es) de prueba.
Desarrollar y mantener procedimientos de prueba.
Ejecutar pruebas funcionales, de smoke y regresiones.","- Experiencia demostrable como analista funcional y tester QA.
- Experiencia y conocimientos de procesos QA y metodologías de desarrollo tradicional y ágil.
- Postman Deseable (No excluyente)
- Conocimientos en automatización (No excluyente)
- Certificacion ISTQB (No excluyente)",https://www.getonbrd.com/empleos/sysadmin-devops-qa/analista-qa-agilesoft-spa-remote
Ingeniero/a DevOps,Chile,Santiago,Híbrido,Semi Senior,FULL_TIME,SysAdmin / DevOps / QA,No hay información,2023-06-20,29.0,NTT DATA Europe & LATAM,"['DevOps', 'Python', 'Virtualization', 'Docker', 'Git', 'Jira', 'Ansible', 'Back-end', 'CI/CD', 'Terraform', 'Infrastructure as Code', 'OpenShift', 'Linux', 'UNIX', 'Confluence', 'Bitbucket', 'Github']","Automatización de tareas para mejorar los tiempos de despliegue.
Apoyo a resolver problemas de infraestructura que puedan aparecer a los equipos de desarrollo.
Interlocutor con el equipo de Delivery para temas de Infraestructura
Análisis de la Arquitectura actual para proponer posibles mejoras en eficiencia y costos.
Asegurar la integración y despliegue continuo
Diseñar y ordenar protocolos de pruebas
Análisis de resultados obtenidos en cada fase de desarrollo","Experiencia comprobada en manejo de sistemas operativos Unix (Linux, Aix, Solaris)
Experiencia en Devops (Pipeline, CI/CD)
Conocimientos en aplicaciones Atlassian (Jira, Confluence, Bitbucket)
Conocimiento en desarrollo de Infraestructura como código: Python, Ansible, Terraform
Conocimientos en manejo de certificados SSL/CSR.
Lenguajes de programación de nivel alto para hacer scripting
Contenedores (OpenShift, Docker)
Repositorios de código (Git, Github, Bitbucket, Artifactory, otros)
Automatización de pruebas",https://www.getonbrd.com/empleos/sysadmin-devops-qa/ingeniero-a-devops-ntt-data-europe-latam-santiago
Senior Front-end Developer,Norteamérica y Sudamérica,,Remoto,Senior,FULL_TIME,Programación,2150.0,2023-06-05,96.0,Crack The Code,"['UX', 'CSS', 'React', 'Web design', 'Next.js', 'Figma', 'Front-end']","Desarrollar aplicaciones web responsivas enfocadas en la experiencia del usuario, con foco en su performance y la optimización para la conversión.
Liderar reuniones de diseño técnico con otros desarrolladores y definir con el equipo la arquitectura front de nuestra web.
Realizar peer review del trabajo de sus compañeros dentro del área de front y asistir en la resolución de las distintas historias.
Ser miembro activo de un equipo de trabajo ágil para el desarrollo y testeo de nuestros productos digitales, colaborando en la construcción de un plan de acción con foco en el cumplimiento de los objetivos
Trabajo y comunicación continua con el equipo de producto y UX/UI para la revisión/planificación de soluciones.","3 años de experiencia utilizando ReactJS
Experiencia laboral como Senior Front End developer de aplicaciones webs.
Visión estética de layouts e interés por la experiencia de usuario.
Familiarización con la optimización de rendimiento web
Alta capacidad de comunicación, organización y planificación.
Planificación y visión para el crecimiento de arquitectura y equipos.
Desarrollo con ReactJS + Development Patterns. Experiencia con Next.js
UI implementation de Diseños en Figma
Interacción con APIs
Tailwind CSS
Implementación de estructura modular
Serverless functions (en Vercel)
Colaborar en tareas de diseño y mejoras de UX
Experiencia con mejora de performance
Conocimiento de UI
Experiencia desplegando en IaaS como Vercel",https://www.getonbrd.com/empleos/programacion/senior-frontend-developer-crack-the-code-remote
Founder and CTO,Chile,Santiago,Híbrido,Senior,FULL_TIME,Programación,5000.0,2023-02-14,69.0,güil Mobility Ventures,"['CTO', 'Cloud']","As Founder and CTO, you will be putting the foundations for shaping the company's technology vision, strategy and execution. You will be leading the development and implementation of product, scalable infrastructure, and best security practices to support the company’s growth.
The company you will be launching is a start-up focused on delivering innovative solutions in the areas of mobile apps, road/travel safety, and InsureTech, this is an opportunity that has been previously validated by a group of entrepreneurs at güil’s research and discovery Lab.
Your Key Responsibilities
Partner with the CEO to define a technology roadmap, contribute to discover the best product solutions to reach a market-fit
Lead the development and implementation of technology solutions
Drive the architecture and design of complex backend applications and mobile apps
Help recruit, build, and manage a high-performing technology team
Ensure that technology infrastructure is secure, scalable, and supports company’s growth
Oversee data processing and cloud infrastructure, ensuring the company can handle growing data needs
Work closely with other stakeholders to ensure technology solutions align with the company's goals and vision
Manage technology budgets and ensure technology solutions are delivered within budget and on time","Qualifications
Proven experience as technical leader, backend leader, CTO, or similar leadership role in technology
Strong technical background with experience in building complex backend services for mobile apps
Proficiency in more than one programming language, the DNA of a generalist more than a specialist
Experience with cloud infrastructure, platform as a service, and data processing in the cloud
Excellent leadership skills, with the ability to manage and motivate a technology team
Strong problem-solving skills and the ability to drive results
Excellent communication and interpersonal skills, with the ability to explain technical concepts to non-technical stakeholders
About You
You’ve been working in technical roles for more than 4 years
You are a hands-on coder, you’re a person that can never stop coding because you love it
You have proven track record in technical leadership, leading/managing teams of developers
You are passionate about technology and you understand how tech contributes to business growth
You stay up-to-date with industry trends and emerging technologies, and evaluate new technology solutions that can improve your own business",https://www.getonbrd.com/empleos/programacion/founder-and-cto-guil-mobility-ventures-santiago
Python Software Engineer,,,Remoto,Semi Senior,FULL_TIME,Programación,No hay información,2023-07-10,83.0,foris.ai,"['MySQL', 'Django', 'Python', 'PostgreSQL', 'Virtualization', 'Docker', 'GraphQL', 'Amazon Web Services', 'API', 'Back-end', 'Agile', 'Cloud Computing', 'Cloud']",,,https://www.getonbrd.com/empleos/programacion/back-end-software-engineer-foris-ai-remote-48ba
Oficial de Seguridad de la Información,Chile,Santiago,Híbrido,Senior,FULL_TIME,Ciberseguridad,2300.0,2023-04-20,66.0,Asesoría y Gestión de Procesos S.A,"['Analytics', 'Cybersecurity', 'Networks', 'Cybersecurity certifications']","Mantener actualizado el SGSI
Liderar las auditorías internas
Mantener vigente ISO 27001 – ISO 27002
Promover iniciativas y proyectos que aumenten la seguridad de la información
Asesorar en forma permanente y cercana a las distintas áreas de la empresa en temas de seguridad de la información
Responder a los requerimientos de corto, mediano y largo plazo de nuestros clientes o grupos de interés referente a todas las temáticas relacionadas a la Seguridad de la información
Asegurar la continuidad operacional
Detectar y estar constantemente en la alerta de la vulnerabilidad de hardware, software y aplicativos
Responder eficazmente ante cualquier las vulneraciones del sistema de seguridad, y posteriormente realizar una investigación del cómo se produjeron las vulneraciones","Ingeniero informático o técnico informático (a) relacionados a carreras de tecnologías de la información, computación, administrador de redes, telecomunicaciones y/o Ciberseguridad
2 a 3 años de experiencia
ISO 27001
Capacidad Analítica
Autonomía e iniciativa
Habilidad comunicacional",https://www.getonbrd.com/empleos/cybersecurity/oficial-de-seguridad-de-la-informacion-asesoria-y-gestion-de-procesos-s-a-santiago
Ingeniero de Sistemas Cargo Wise One,Chile,Santiago,Híbrido,Semi Senior,FULL_TIME,SysAdmin / DevOps / QA,2450.0,2023-07-18,8.0,Eficazmente,"['SQL', 'C#', 'HTML5', 'C', 'PHP', 'CSS', 'Virtualization', 'Azure', 'Amazon Web Services', 'API', 'Postman', 'Back-end', 'Cloud Computing', 'JavaScript', 'Cloud', 'Java']","Implementación de mejoras, personalización, desarrollos, optimizaciones e integraciones en CargoWise One, por este motivo es indispensable que conozca Cargo Wise One.","Formación Requerida:
Ingeniero en Ejecución, Analista de Sistemas o Programador con especialización en computación o informática, obtenido en alguna Universidad y/o Instituto profesional acreditado.
Años de Experiencia: 3 o más
Requisitos técnicos:
--> Conocimiento avanzado de SQL Server
--> Conocimiento y manejo de lenguajes de programación (PHP, javascript, C#, herramientas de programación), opcional Java. 
--> Conocimiento de HTML, DOM, CSS.
--> Conocimiento de uso de APIs, experiencia con SOAP UI y Postman como herramientas para validar/probar APIs.
--> Dominio de CargoWise One (excluyente)
--> Deseable experiencia en freight forwarder, agencia de aduana, naviera y/o similares en la industria.
--> Capacidad de entender/mejorar/diseñar procesos.
--> Rápido para aprender y apasionado por los desafíos.
--> Deseable conocimiento de AWS y Azure.",https://www.getonbrd.com/empleos/sysadmin-devops-qa/ingeniero-de-sistemas-cargo-wise-one-eficazmente-santiago
